root@lamp-s-1vcpu-1gb-tor1-01:~# tcpdump -w 0001.pcap -i eth0
tcpdump: listening on eth0, link-type EN10MB (Ethernet), capture size 262144 bytes
^C16 packets captured
19 packets received by filter
0 packets dropped by kernel
root@lamp-s-1vcpu-1gb-tor1-01:~# tcpdump -r 0001.pcap
reading from file 0001.pcap, link-type EN10MB (Ethernet)
15:50:50.386730 IP lamp-s-1vcpu-1gb-tor1-01.ssh > 198.96.85.163.53430: Flags [P.], seq 3298991105:3298991149, ack 204821728, win 501, options [nop,nop,TS val 573427291 ecr 1291600606], length 44
15:50:50.386854 IP lamp-s-1vcpu-1gb-tor1-01.ssh > 198.96.85.163.53430: Flags [P.], seq 44:152, ack 1, win 501, options [nop,nop,TS val 573427291 ecr 1291600606], length 108
15:50:50.386988 IP lamp-s-1vcpu-1gb-tor1-01.ssh > 198.96.85.163.53430: Flags [P.], seq 152:188, ack 1, win 501, options [nop,nop,TS val 573427292 ecr 1291600606], length 36
15:50:50.388714 IP 198.96.85.163.53430 > lamp-s-1vcpu-1gb-tor1-01.ssh: Flags [.], ack 44, win 2047, options [nop,nop,TS val 1291600611 ecr 573427291], length 0
15:50:50.388999 IP 198.96.85.163.53430 > lamp-s-1vcpu-1gb-tor1-01.ssh: Flags [.], ack 152, win 2046, options [nop,nop,TS val 1291600612 ecr 573427291], length 0
15:50:50.389014 IP 198.96.85.163.53430 > lamp-s-1vcpu-1gb-tor1-01.ssh: Flags [.], ack 188, win 2047, options [nop,nop,TS val 1291600612 ecr 573427292], length 0
15:50:52.260844 IP 108.162.241.70.33566 > lamp-s-1vcpu-1gb-tor1-01.http: Flags [S], seq 1171067212, win 65535, options [mss 1460,nop,nop,sackOK,nop,wscale 10], length 0
15:50:52.260930 IP lamp-s-1vcpu-1gb-tor1-01.http > 108.162.241.70.33566: Flags [S.], seq 2906220520, ack 1171067213, win 64240, options [mss 1460,nop,nop,sackOK,nop,wscale 7], length 0
15:50:52.261269 IP 108.162.241.70.33566 > lamp-s-1vcpu-1gb-tor1-01.http: Flags [.], ack 1, win 64, length 0
15:50:52.261285 IP 108.162.241.70.33566 > lamp-s-1vcpu-1gb-tor1-01.http: Flags [P.], seq 1:476, ack 1, win 64, length 475: HTTP: GET /porno-le-simpson.html HTTP/1.1
15:50:52.261326 IP lamp-s-1vcpu-1gb-tor1-01.http > 108.162.241.70.33566: Flags [.], ack 476, win 501, length 0
15:50:52.261756 IP lamp-s-1vcpu-1gb-tor1-01.http > 108.162.241.70.33566: Flags [P.], seq 1:497, ack 476, win 501, length 496: HTTP: HTTP/1.1 404 Not Found
15:50:52.262093 IP 108.162.241.70.33566 > lamp-s-1vcpu-1gb-tor1-01.http: Flags [.], ack 497, win 66, length 0
15:50:57.267062 IP lamp-s-1vcpu-1gb-tor1-01.http > 108.162.241.70.33566: Flags [F.], seq 497, ack 476, win 501, length 0
15:50:57.267444 IP 108.162.241.70.33566 > lamp-s-1vcpu-1gb-tor1-01.http: Flags [F.], seq 476, ack 498, win 66, length 0
15:50:57.267493 IP lamp-s-1vcpu-1gb-tor1-01.http > 108.162.241.70.33566: Flags [.], ack 477, win 501, length 0
